mysql> use invoice;
Database changed
mysql> select *from invoice_item;
+--------+------+----------+
| INV_ID | P_ID | QUANTITY |
+--------+------+----------+
|      1 |    4 |        4 |
|      1 |    5 |        6 |
|      1 |    2 |        1 |
|      2 |    1 |        2 |
|      2 |    2 |        2 |
|      3 |    3 |        2 |
|      3 |    5 |        1 |
|      4 |    1 |        1 |
|      4 |    4 |        5 |
|      4 |    2 |        2 |
|      5 |    3 |        1 |
+--------+------+----------+
11 rows in set (0.04 sec)

mysql> delete from invoice_item where inv_id=5;
Query OK, 1 row affected (0.11 sec)

mysql> select *from invoice_item;
+--------+------+----------+
| INV_ID | P_ID | QUANTITY |
+--------+------+----------+
|      1 |    4 |        4 |
|      1 |    5 |        6 |
|      1 |    2 |        1 |
|      2 |    1 |        2 |
|      2 |    2 |        2 |
|      3 |    3 |        2 |
|      3 |    5 |        1 |
|      4 |    1 |        1 |
|      4 |    4 |        5 |
|      4 |    2 |        2 |
+--------+------+----------+
10 rows in set (0.00 sec)

mysql> select *from invoice_master;
+--------+------+------------+
| INV_ID | C_ID | INV_DATE   |
+--------+------+------------+
|      1 |    5 | 2021-01-02 |
|      2 |    3 | 2021-01-23 |
|      3 |    1 | 2020-12-27 |
|      4 |    2 | 2021-02-15 |
|      5 |    4 | 2021-04-19 |
+--------+------+------------+
5 rows in set (0.03 sec)

mysql> delete from invoice_master where inv_id=5;
Query OK, 1 row affected (0.25 sec)

mysql> select *from invoice_master;
+--------+------+------------+
| INV_ID | C_ID | INV_DATE   |
+--------+------+------------+
|      1 |    5 | 2021-01-02 |
|      2 |    3 | 2021-01-23 |
|      3 |    1 | 2020-12-27 |
|      4 |    2 | 2021-02-15 |
+--------+------+------------+
4 rows in set (0.00 sec)


//verified
